<ClassPage
    xmlns:xsi="http://www.w3.org/2001/XMLSchema-instance"
    xsi:noNamespaceSchemaLocation="../../../Schema/CppPage.xsd"
    IsFinal="true"
    Name="Version">

    <Description>CellSimのバージョン情報を提供します。</Description>

    <StaticMethods>
        <Function Path="Extension/" />
        <Function Path="Major/" />
        <Function Path="Minor/" />
        <Function Path="Patch/" />
    </StaticMethods>

    <Constructors>
        <DefaultConstructor Type="Deleted" />
        <CopyConstructor Type="Deleted" />
        <MoveConstructor Type="Deleted" />
    </Constructors>

    <Destructor Type="Deleted" />

    <Operators>
        <CopyOperator Type="Deleted" />
        <MoveOperator Type="Deleted" />
    </Operators>

</ClassPage>